[
  {
    "id": 97,
    "category": "Precision",
    "question": "What is the genomic location of the human TP53 gene according to NCBI Gene?",
    "expected_answer": "Chromosome 17p13.1",
    "notes": "Database: NCBI Gene. Tests gene mapping information. TP53 is at a well-characterized locus. Verified using ncbi_esummary for gene ID 7157. Found in ncbigene_exploration.md."
  },
  {
    "id": 98,
    "category": "Precision",
    "question": "What is the PDB ID for the structure of human hemoglobin?",
    "expected_answer": "Multiple PDB IDs including 1A3N, 2HHB, 1GZX",
    "notes": "Database: PDB. Tests classic protein structure identification. Hemoglobin has many structural variants. Verified using search_pdb_entity('hemoglobin human'). Found in pdb_exploration.md."
  },
  {
    "id": 99,
    "category": "Completeness",
    "question": "How many genes are documented in the NCBI Gene database for Homo sapiens?",
    "expected_answer": "Approximately 60,000 gene entries",
    "notes": "Database: NCBI Gene. Tests human genome annotation completeness. Includes protein-coding and non-coding genes. Verified using ncbi_esearch with organism filter. Found in ncbigene_exploration.md."
  },
  {
    "id": 100,
    "category": "Completeness",
    "question": "How many bioassays are available in PubChem?",
    "expected_answer": "Over 1.7 million bioassays",
    "notes": "Database: PubChem. Tests biological screening data volume. PubChem integrates assay data from multiple sources. Verified via database statistics. Found in pubchem_exploration.md."
  },
  {
    "id": 101,
    "category": "Integration",
    "question": "What are the orthologous genes to human BRCA1 in mouse according to NCBI Gene?",
    "expected_answer": "Mouse Brca1 (gene ID 12189)",
    "notes": "Databases: NCBI Gene. Tests orthology mapping between species. BRCA1 orthologs are used in cancer models. Verified using NCBI Gene orthology data. Found in ncbigene_exploration.md."
  },
  {
    "id": 102,
    "category": "Integration",
    "question": "What Rhea reaction IDs involve the compound with ChEBI:16761 (adenosine)?",
    "expected_answer": "Multiple Rhea reactions involving adenosine phosphorylation, deamination, etc.",
    "notes": "Databases: Rhea, ChEBI. Tests compound-to-reaction mapping. Adenosine participates in nucleotide metabolism. Verified using Rhea search. Found in rhea_exploration.md."
  },
  {
    "id": 103,
    "category": "Currency",
    "question": "What are the most recent Gene Ontology terms added for immune system processes?",
    "expected_answer": "Recent GO terms for innate immunity, cytokine signaling, immune checkpoints",
    "notes": "Database: GO. Tests ontology curation currency. GO continuously adds terms for emerging immunology. Requires filtering by namespace and addition date. Found in go_exploration.md."
  },
  {
    "id": 104,
    "category": "Currency",
    "question": "How many new bacterial resistance mechanisms were documented in AMR Portal in the last year?",
    "expected_answer": "Multiple newly identified resistance genes and mechanisms",
    "notes": "Database: AMR Portal. Tests surveillance of emerging resistance. New resistance determinants are continuously discovered. Requires temporal filtering. Found in amrportal_exploration.md."
  },
  {
    "id": 105,
    "category": "Specificity",
    "question": "What is the NCBI Taxonomy ID for Saccharomyces cerevisiae S288C?",
    "expected_answer": "559292",
    "notes": "Database: Taxonomy. Tests model organism strain identification. S288C is the reference yeast strain. Different from generic S. cerevisiae taxid. Verified using taxonomy search. Found in taxonomy_exploration.md."
  },
  {
    "id": 106,
    "category": "Specificity",
    "question": "What is the clinical significance of the BRCA1 variant c.68_69delAG in ClinVar?",
    "expected_answer": "Pathogenic - founder mutation causing breast and ovarian cancer",
    "notes": "Database: ClinVar. Tests specific variant interpretation. This is the 185delAG founder mutation in Ashkenazi Jewish populations. Verified via ClinVar variant lookup. Found in clinvar_exploration.md."
  },
  {
    "id": 107,
    "category": "Structured Query",
    "question": "Find all MeSH terms under the 'Cardiovascular Diseases' tree that relate to myocardial infarction.",
    "expected_answer": "Multiple MeSH descriptors including acute MI, STEMI, NSTEMI",
    "notes": "Database: MeSH. Tests medical terminology hierarchy with disease subtype filtering. Requires tree navigation and text matching. Verified using search_mesh_entity. Found in mesh_exploration.md."
  },
  {
    "id": 108,
    "category": "Structured Query",
    "question": "What Ensembl genes have both protein-coding biotype and are located on the X chromosome in humans?",
    "expected_answer": "Hundreds of X-linked protein-coding genes",
    "notes": "Database: Ensembl. Tests gene filtering by type and location. X chromosome genes are important for sex-linked disorders. Requires biotype and chromosome filtering. Found in ensembl_exploration.md."
  }
]
