[
  {
    "id": 85,
    "category": "Precision",
    "question": "What is the UniProt ID for the CRISPR-associated endonuclease Cas9 from Streptococcus pyogenes?",
    "expected_answer": "Q99ZW2",
    "notes": "Database: UniProt. Tests specific protein identification for genome editing enzyme. SpCas9 is the most widely used CRISPR nuclease. Verified using search_uniprot_entity('Cas9 Streptococcus pyogenes'). Found in uniprot_exploration.md."
  },
  {
    "id": 86,
    "category": "Precision",
    "question": "What is the molecular formula of ethanol according to PubChem?",
    "expected_answer": "C2H6O",
    "notes": "Database: PubChem. Tests basic chemical property retrieval. Ethanol is CID 702. Verified using get_compound_attributes. Found in pubchem_exploration.md."
  },
  {
    "id": 87,
    "category": "Completeness",
    "question": "How many chemical entities are classified in the ChEBI ontology?",
    "expected_answer": "Over 217,000 chemical entities",
    "notes": "Database: ChEBI. Tests chemical ontology database size. ChEBI is a comprehensive structured classification of chemical entities. Verified via database statistics. Found in chebi_exploration.md."
  },
  {
    "id": 88,
    "category": "Completeness",
    "question": "How many disease-gene associations are documented in PubTator?",
    "expected_answer": "Millions of gene-disease annotations from literature",
    "notes": "Database: PubTator. Tests biomedical text mining database scale. PubTator extracts entities from PubMed articles. Verified via database statistics. Found in pubtator_exploration.md."
  },
  {
    "id": 89,
    "category": "Integration",
    "question": "What is the DrugBank ID for the ChEMBL compound CHEMBL941?",
    "expected_answer": "DB00619 (imatinib)",
    "notes": "Databases: ChEMBL, DrugBank. Tests drug database cross-referencing. CHEMBL941 is imatinib (Gleevec). Verified using ChEMBL cross-references. Found in chembl_exploration.md."
  },
  {
    "id": 90,
    "category": "Integration",
    "question": "What GO terms are annotated to the UniProt protein P38398 (BRCA1)?",
    "expected_answer": "Multiple GO terms including DNA repair, transcription regulation, ubiquitin ligase activity",
    "notes": "Databases: UniProt, GO. Tests protein function annotation retrieval. BRCA1 has diverse molecular functions. Verified using UniProt entry GO annotations. Found in uniprot_exploration.md."
  },
  {
    "id": 91,
    "category": "Currency",
    "question": "What mRNA vaccine-related pathways have been added to Reactome since 2020?",
    "expected_answer": "COVID-19 vaccine mechanism pathways, mRNA translation, immune activation",
    "notes": "Database: Reactome. Tests pathway curation for emerging technologies. mRNA vaccines became prominent with COVID-19. Requires searching recent pathway additions. Found in reactome_exploration.md."
  },
  {
    "id": 92,
    "category": "Currency",
    "question": "How many crystal structures were deposited in PDB in 2024?",
    "expected_answer": "Several thousand new X-ray structures",
    "notes": "Database: PDB. Tests structural biology deposition rate. PDB receives continuous depositions. Requires filtering by experimental method and date. Found in pdb_exploration.md."
  },
  {
    "id": 93,
    "category": "Specificity",
    "question": "What is the MONDO ID for Prader-Willi syndrome?",
    "expected_answer": "MONDO:0010035",
    "notes": "Database: MONDO. Tests rare genetic disorder identification. Prader-Willi is caused by genomic imprinting defects. Verified using OLS4 searchClasses in MONDO. Found in mondo_exploration.md."
  },
  {
    "id": 94,
    "category": "Specificity",
    "question": "What culture medium is recommended in MediaDive for cultivating methanogens?",
    "expected_answer": "Anaerobic media with reducing agents, specific for methanogenic archaea",
    "notes": "Database: MediaDive. Tests specialized microbiology culture knowledge. Methanogens require strict anaerobic conditions. Verified via MediaDive search. Found in mediadive_exploration.md."
  },
  {
    "id": 95,
    "category": "Structured Query",
    "question": "Find all Rhea reactions that involve electron transfer and are classified as oxidoreductase reactions.",
    "expected_answer": "Thousands of redox reactions with EC class 1",
    "notes": "Database: Rhea. Tests biochemical reaction classification filtering. Oxidoreductases catalyze electron transfer. Requires EC number and reaction type filtering. Verified using Rhea search. Found in rhea_exploration.md."
  },
  {
    "id": 96,
    "category": "Structured Query",
    "question": "What ClinVar variants for BRCA1 are classified as pathogenic with multiple stars of clinical significance?",
    "expected_answer": "Numerous pathogenic BRCA1 variants with expert review status",
    "notes": "Database: ClinVar. Tests variant filtering by gene, pathogenicity, and review status. Star ratings indicate evidence strength. Requires multi-criteria filtering. Found in clinvar_exploration.md."
  }
]
