[
  {
    "id": 61,
    "category": "Precision",
    "question": "What is the EC number for the biochemical reaction RHEA:10000 in the Rhea database?",
    "expected_answer": "EC 3.5.1.50 (pentanamide hydrolysis)",
    "notes": "Uses Rhea database. Verified in rhea_exploration.md showing RHEA:10000 is pentanamide hydrolysis with EC 3.5.1.50 and GO:0050168. Tests enzyme classification retrieval."
  },
  {
    "id": 62,
    "category": "Precision",
    "question": "What is the molecular formula of resveratrol in PubChem (CID445154)?",
    "expected_answer": "C14H12O3",
    "notes": "Uses PubChem database. Verified in pubchem_exploration.md showing resveratrol with molecular weight 228.24. Tests molecular descriptor retrieval from chemical database."
  },
  {
    "id": 63,
    "category": "Completeness",
    "question": "How many bioactive molecules with drug-like properties are in ChEMBL?",
    "expected_answer": "2.4 million compounds",
    "notes": "Uses ChEMBL database. Verified in chembl_exploration.md showing 2.4M+ compounds with bioactivity data. Tests understanding of medicinal chemistry database scale."
  },
  {
    "id": 64,
    "category": "Completeness",
    "question": "List all major disease categories in NANDO with their Japanese names.",
    "expected_answer": "15 categories including Neuromuscular (神経・筋疾患), Metabolic (代謝系疾患), Immune system (免疫系疾患), etc.",
    "notes": "Uses NANDO database. Verified in nando_exploration.md showing 15 major disease categories with bilingual labels. Tests Japanese rare disease ontology navigation."
  },
  {
    "id": 65,
    "category": "Integration",
    "question": "What KEGG Disease ID corresponds to Parkinson's disease (NANDO:1200010)?",
    "expected_answer": "KEGG H00057",
    "notes": "Uses NANDO and KEGG databases. Verified in nando_exploration.md showing rdfs:seeAlso links to KEGG Disease. ~500 diseases have KEGG links. Tests cross-database disease integration."
  },
  {
    "id": 66,
    "category": "Integration",
    "question": "Convert the PDB entry 16PK to its EMDB electron microscopy density map identifier if available.",
    "expected_answer": "Check for EMDB cross-reference (~7% of PDB entries have EMDB links)",
    "notes": "Uses PDB and EMDB databases. Verified in pdb_exploration.md showing ~7% coverage for cryo-EM structures via pdbx:database_2. Tests structure-to-map database linking."
  },
  {
    "id": 67,
    "category": "Currency",
    "question": "How many disease classes in MONDO have been mapped to the Japanese NANDO database?",
    "expected_answer": "~8% coverage representing rare disease harmonization",
    "notes": "Uses MONDO and NANDO databases. Verified in mondo_exploration.md and nando_exploration.md showing international-Japanese disease mapping via skos:closeMatch."
  },
  {
    "id": 68,
    "category": "Currency",
    "question": "What is the most recent genome assembly release for Ensembl human annotations?",
    "expected_answer": "GRCh38, Release 114 (or current release)",
    "notes": "Uses Ensembl database. Verified in ensembl_exploration.md showing regular release cycle. Tests awareness of current genomics database versions."
  },
  {
    "id": 69,
    "category": "Specificity",
    "question": "What is the notification number for Spinal and bulbar muscular atrophy (NANDO:1200001) in the Japanese intractable disease system?",
    "expected_answer": "Notification number 1",
    "notes": "Uses NANDO database. Verified in nando_exploration.md showing nando:hasNotificationNumber property for government-designated diseases. Tests Japanese healthcare policy data."
  },
  {
    "id": 70,
    "category": "Specificity",
    "question": "What polymerization index notation is used in Rhea reaction RHEA:19749 for polymer synthesis?",
    "expected_answer": "n and n+1 (showing polymerization from n to n+1)",
    "notes": "Uses Rhea database. Verified in rhea_exploration.md showing polymer reactions with rhea:polymerizationIndex. Tests specialized biochemical notation understanding."
  },
  {
    "id": 71,
    "category": "Structured Query",
    "question": "Find all diseases in MONDO that have cross-references to both OMIM and Orphanet databases.",
    "expected_answer": "Multiple genetic/rare diseases (33% have OMIM, 34% have Orphanet, overlap exists)",
    "notes": "Uses MONDO database. Verified in mondo_exploration.md showing oboInOwl:hasDbXref for external links. Tests multi-database integration queries."
  },
  {
    "id": 72,
    "category": "Structured Query",
    "question": "How many protein structures in PDB were determined by X-ray diffraction versus electron microscopy?",
    "expected_answer": "X-ray: 174,904 (85.5%), Electron microscopy: 15,032 (7.3%)",
    "notes": "Uses PDB database. Verified in pdb_exploration.md showing experimental method distribution via pdbx:exptl.method. Tests structural biology method comparison."
  }
]
