[
  {
    "id": 37,
    "category": "Precision",
    "question": "What is the Ensembl gene ID for human BRCA1?",
    "expected_answer": "ENSG00000012048",
    "notes": "Uses Ensembl database. Verified in ensembl_exploration.md. BRCA1 is located on chromosome 17:43044295-43170245 on negative strand. Tests gene ID retrieval from genomics database."
  },
  {
    "id": 38,
    "category": "Precision",
    "question": "What is the NCBI Taxonomy ID for humans (Homo sapiens)?",
    "expected_answer": "9606",
    "notes": "Uses NCBI Taxonomy database. Verified in taxonomy_exploration.md. Human (taxon 9606) is the most studied organism. Tests organism identification in comprehensive taxonomy."
  },
  {
    "id": 39,
    "category": "Completeness",
    "question": "How many protein-coding genes are in the NCBI Gene database?",
    "expected_answer": "46,105,590 genes (~80% of 57.7 million total)",
    "notes": "Uses NCBI Gene database. Verified in ncbigene_exploration.md showing 57,768,578 total genes with 80% being protein-coding. Tests understanding of gene type distribution."
  },
  {
    "id": 40,
    "category": "Completeness",
    "question": "What is the complete taxonomic lineage of Homo sapiens from genus to root?",
    "expected_answer": "Homo → Hominidae → Primates → Mammalia → Chordata → Metazoa → Eukaryota → root",
    "notes": "Uses Taxonomy database. Verified in taxonomy_exploration.md showing 7 major ranks from human to root. Tests hierarchical taxonomy navigation."
  },
  {
    "id": 41,
    "category": "Integration",
    "question": "What is the UniProt ID for the BRCA1 protein, given Ensembl protein ID ENSP00000478114?",
    "expected_answer": "P38398",
    "notes": "Uses Ensembl and UniProt databases. Verified in ensembl_exploration.md showing rdfs:seeAlso cross-references. Tests protein database integration."
  },
  {
    "id": 42,
    "category": "Integration",
    "question": "What is the HGNC identifier for the BRCA1 gene from Ensembl?",
    "expected_answer": "HGNC:1100",
    "notes": "Uses Ensembl and HGNC databases. Verified in ensembl_exploration.md showing extensive HGNC coverage via rdfs:seeAlso. Tests gene nomenclature integration."
  },
  {
    "id": 43,
    "category": "Currency",
    "question": "What genome assembly version does Ensembl currently use for human annotations?",
    "expected_answer": "GRCh38 (Release 114 or current)",
    "notes": "Uses Ensembl database. Verified in ensembl_exploration.md. Tests understanding of current genome assembly versions and database release cycles."
  },
  {
    "id": 44,
    "category": "Currency",
    "question": "How many taxa are currently in the NCBI Taxonomy database?",
    "expected_answer": "2,698,386 taxa",
    "notes": "Uses NCBI Taxonomy database. Verified in taxonomy_exploration.md showing comprehensive coverage across all life. Tests current database size awareness."
  },
  {
    "id": 45,
    "category": "Specificity",
    "question": "What is the strand orientation (forward or reverse) of the BRCA1 gene on chromosome 17?",
    "expected_answer": "Reverse/negative strand",
    "notes": "Uses Ensembl database. Verified in ensembl_exploration.md showing chr17:43044295-43170245 on negative strand. Uses FALDO ontology for strand detection. Tests retrieval of specific genomic features."
  },
  {
    "id": 46,
    "category": "Specificity",
    "question": "How many exons does the TP53 transcript ENST00000269305 have?",
    "expected_answer": "11 exons",
    "notes": "Uses Ensembl database. Verified in ensembl_exploration.md showing 11 ordered exons (ENSE00003753508 through ENSE00004023724). Tests transcript structure analysis."
  },
  {
    "id": 47,
    "category": "Structured Query",
    "question": "Find all human protein-coding genes on the Y chromosome in Ensembl.",
    "expected_answer": "20+ genes including SRY, AMELY, ZFY, UTY, DDX3Y, USP9Y",
    "notes": "Uses Ensembl database. Verified in ensembl_exploration.md showing sex chromosome gene content. Tests chromosome-specific gene enumeration with biotype filtering."
  },
  {
    "id": 48,
    "category": "Structured Query",
    "question": "What is the full taxonomic lineage of Drosophila melanogaster (taxon 7227) including only major ranks?",
    "expected_answer": "Genus through Kingdom: Drosophila → Drosophilidae → Diptera → Insecta → Arthropoda → Metazoa",
    "notes": "Uses Taxonomy database. Verified in taxonomy_exploration.md showing hierarchical structure via rdfs:subClassOf+. Tests lineage traversal with rank filtering."
  }
]
