[
  {
    "id": 13,
    "category": "Precision",
    "question": "What is the molecular formula of ATP according to the Rhea biochemical reactions database?",
    "expected_answer": "C10H12N5O13P3",
    "notes": "Uses Rhea database. Verified in rhea_exploration.md showing ATP compound has formula C10H12N5O13P3 with charge -4 and ChEBI:30616. Tests retrieval of specific molecular properties from biochemical database."
  },
  {
    "id": 14,
    "category": "Precision",
    "question": "What is the PDB ID of the protein structure with the highest resolution ever achieved?",
    "expected_answer": "5D8V or 3NIR (both 0.48 Angstroms)",
    "notes": "Uses PDB database. Verified in pdb_exploration.md showing two structures tied for best resolution at 0.48 Ã…: 5D8V (R-work 0.072) and 3NIR (R-work 0.127). Tests identification of exceptional quality structural data."
  },
  {
    "id": 15,
    "category": "Completeness",
    "question": "How many approved biochemical reactions are in the Rhea database?",
    "expected_answer": "66,740 approved reactions",
    "notes": "Uses Rhea database. Verified in rhea_exploration.md showing 66,740 approved reactions out of 68,312 total (also 452 preliminary and 1,120 obsolete). Tests ability to count and filter by reaction status."
  },
  {
    "id": 16,
    "category": "Completeness",
    "question": "How many protein structure entries in PDB were determined using electron microscopy?",
    "expected_answer": "15,032 structures",
    "notes": "Uses PDB database. Verified in pdb_exploration.md showing electron microscopy accounts for 7.3% of PDB structures (15,032 out of 204,594 total). Tests counting by experimental method."
  },
  {
    "id": 17,
    "category": "Integration",
    "question": "What is the ChEBI identifier for ATP in the Rhea database?",
    "expected_answer": "CHEBI:30616",
    "notes": "Uses Rhea and ChEBI databases. Verified in rhea_exploration.md showing ATP links to CHEBI:30616. Rhea has 100% ChEBI coverage for all 11,763 small molecules. Tests cross-database chemical compound integration."
  },
  {
    "id": 18,
    "category": "Integration",
    "question": "What is the UniProt accession for the protein in PDB entry 16PK?",
    "expected_answer": "P07378",
    "notes": "Uses PDB and UniProt databases. Verified in pdb_exploration.md. Tests protein structure-to-sequence database linking. PDB has ~172% UniProt refs per entry (multiple chains)."
  },
  {
    "id": 19,
    "category": "Currency",
    "question": "What is the current approval status distribution in Rhea biochemical reactions database?",
    "expected_answer": "66,740 approved, 452 preliminary, 1,120 obsolete",
    "notes": "Uses Rhea database. Verified in rhea_exploration.md showing current status counts. Tests access to curation status and database currency information."
  },
  {
    "id": 20,
    "category": "Currency",
    "question": "What is the distribution of experimental methods used in recent PDB depositions?",
    "expected_answer": "X-ray diffraction ~85%, electron microscopy ~7%, solution NMR ~7%",
    "notes": "Uses PDB database. Verified in pdb_exploration.md showing 174,904 X-ray (85.5%), 15,032 EM (7.3%), 13,902 NMR (6.8%). Tests understanding of current structural biology techniques."
  },
  {
    "id": 21,
    "category": "Specificity",
    "question": "What is the charge of ATP according to the Rhea database?",
    "expected_answer": "-4",
    "notes": "Uses Rhea database. Verified in rhea_exploration.md showing ATP has molecular charge -4 at physiological pH. Tests retrieval of specific chemical properties beyond molecular formula."
  },
  {
    "id": 22,
    "category": "Specificity",
    "question": "What is the R-work refinement statistic for PDB entry 5D8V, the highest resolution structure?",
    "expected_answer": "0.072",
    "notes": "Uses PDB database. Verified in pdb_exploration.md showing 5D8V has R-work of 0.072, indicating exceptional refinement quality. Tests retrieval of crystallographic quality metrics."
  },
  {
    "id": 23,
    "category": "Structured Query",
    "question": "How many transport reactions are annotated in the Rhea database?",
    "expected_answer": "5,984 transport reactions",
    "notes": "Uses Rhea database. Verified in rhea_exploration.md showing 5,984 transport reactions (35% of total) with explicit cellular location annotations (rhea:In and rhea:Out). Tests filtering by reaction type."
  },
  {
    "id": 24,
    "category": "Structured Query",
    "question": "Find all GO molecular function terms associated with ATP-related reactions in Rhea.",
    "expected_answer": "Multiple GO terms linked via rdfs:seeAlso (~55% of reactions have GO terms)",
    "notes": "Uses Rhea and GO databases. Verified in rhea_exploration.md showing ~55% of reactions have GO molecular function cross-references. Tests complex cross-database querying with structured filtering."
  }
]
