[
  {
    "id": 73,
    "category": "Precision",
    "question": "What is the standard Gibbs free energy change for the ATP hydrolysis reaction in Rhea?",
    "expected_answer": "Approximately -30.5 kJ/mol under standard conditions",
    "notes": "Database: Rhea. Tests thermodynamic data retrieval for fundamental biochemical reaction. ATP hydrolysis (Rhea:13065) is the primary cellular energy currency reaction. Verified via Rhea reaction data. Found in rhea_exploration.md."
  },
  {
    "id": 74,
    "category": "Precision",
    "question": "What is the amino acid sequence length of human insulin protein in UniProt?",
    "expected_answer": "110 amino acids (preproinsulin), 51 for mature insulin",
    "notes": "Database: UniProt. Tests protein sequence property retrieval. Human insulin is P01308. Mature form is cleaved from preproinsulin. Verified using UniProt entry. Found in uniprot_exploration.md."
  },
  {
    "id": 75,
    "category": "Completeness",
    "question": "How many phenotypic antimicrobial susceptibility test results are recorded in AMR Portal?",
    "expected_answer": "Over 1.7 million AST results",
    "notes": "Database: AMR Portal. Tests antimicrobial resistance data volume. AST results include MIC and disk diffusion data. Verified via database statistics. Found in amrportal_exploration.md."
  },
  {
    "id": 76,
    "category": "Completeness",
    "question": "How many terms are in the MeSH vocabulary across all categories?",
    "expected_answer": "Over 30,000 descriptors plus 250,000+ supplementary concepts",
    "notes": "Database: MeSH. Tests medical terminology database comprehensiveness. MeSH includes descriptors and supplementary chemical/disease concepts. Verified via MeSH statistics. Found in mesh_exploration.md."
  },
  {
    "id": 77,
    "category": "Integration",
    "question": "What Reactome pathway IDs are associated with UniProt protein P04637 (TP53)?",
    "expected_answer": "Multiple pathways including p53 signaling, apoptosis, DNA damage response",
    "notes": "Databases: UniProt, Reactome. Tests protein-to-pathway mapping. TP53 participates in numerous cellular pathways. Verified using UniProt cross-references or Reactome search. Found in reactome_exploration.md."
  },
  {
    "id": 78,
    "category": "Integration",
    "question": "What MedGen concept ID corresponds to ClinVar's variant for Huntington disease?",
    "expected_answer": "C0020179",
    "notes": "Databases: ClinVar, MedGen. Tests variant-to-concept mapping. Huntington disease variants link to MedGen clinical concepts. Verified using ClinVar-MedGen cross-references. Found in clinvar_exploration.md and medgen_exploration.md."
  },
  {
    "id": 79,
    "category": "Currency",
    "question": "What are the most recently characterized glycan structures in GlyCosmos?",
    "expected_answer": "Recently added glycan entries from latest publications",
    "notes": "Database: GlyCosmos. Tests access to new glycobiology discoveries. GlyCosmos updates with newly characterized structures. Requires date-based filtering. Found in glycosmos_exploration.md."
  },
  {
    "id": 80,
    "category": "Currency",
    "question": "How many genome assemblies for bacterial species were added to NCBI in 2024?",
    "expected_answer": "Thousands of new bacterial genome assemblies",
    "notes": "Database: DDBJ/NCBI. Tests genomic data currency. Bacterial genome sequencing continues at high rate. Verified using database statistics with date filters. Found in ddbj_exploration.md."
  },
  {
    "id": 81,
    "category": "Specificity",
    "question": "What is the ChEBI classification of resveratrol as a biological role?",
    "expected_answer": "Antioxidant, phytoalexin, plant metabolite",
    "notes": "Database: ChEBI. Tests chemical ontology classification. Resveratrol (CHEBI:27881) has multiple biological roles. Verified using ChEBI hierarchy. Found in chebi_exploration.md."
  },
  {
    "id": 82,
    "category": "Specificity",
    "question": "What is the salt requirement for growing Halobacterium salinarum according to BacDive?",
    "expected_answer": "Requires 15-30% NaCl (extreme halophile)",
    "notes": "Database: BacDive. Tests extremophile cultivation requirements. H. salinarum is a model halophilic archaeon. Baseline unlikely to know specific salt concentrations. Verified via BacDive growth conditions. Found in bacdive_exploration.md."
  },
  {
    "id": 83,
    "category": "Structured Query",
    "question": "Find all PubMed articles about breast cancer that were published in Nature or Science journals.",
    "expected_answer": "Hundreds of high-impact breast cancer research articles",
    "notes": "Database: PubMed. Tests publication filtering by topic and journal. Requires combining MeSH term with journal name filter. Verified using PubMed:search_articles with field tags. Found in pubmed_exploration.md."
  },
  {
    "id": 84,
    "category": "Structured Query",
    "question": "What are the ChEBI terms that are classified as both 'drug' and 'hormone'?",
    "expected_answer": "Compounds like corticosteroids, thyroid hormones used therapeutically",
    "notes": "Database: ChEBI. Tests ontology classification intersection. Some hormones are also drugs. Requires combining multiple role classifications. Verified using ChEBI hierarchy queries. Found in chebi_exploration.md."
  }
]
