[
  {
    "id": 1,
    "category": "Precision",
    "question": "What is the UniProt accession ID for human BRCA1 protein?",
    "expected_answer": "P38398",
    "notes": "Database: UniProt. Tests exact protein ID lookup for a major breast cancer susceptibility gene. Baseline cannot provide specific UniProt accessions. Verified using search_uniprot_entity('BRCA1 human'). Found in uniprot_exploration.md."
  },
  {
    "id": 2,
    "category": "Precision",
    "question": "What is the PubChem Compound ID (CID) for aspirin?",
    "expected_answer": "2244",
    "notes": "Database: PubChem. Tests chemical compound ID lookup. Baseline unlikely to know specific CID numbers. Verified using get_pubchem_compound_id('aspirin'). Found in pubchem_exploration.md."
  },
  {
    "id": 3,
    "category": "Completeness",
    "question": "How many descendant terms does the Gene Ontology term 'autophagy' (GO:0006914) have?",
    "expected_answer": "25 descendant terms",
    "notes": "Database: GO. Tests hierarchical ontology navigation and counting. Baseline cannot enumerate exact descendant counts. Verified using OLS4:getDescendants(GO:0006914). Found in go_exploration.md."
  },
  {
    "id": 4,
    "category": "Completeness",
    "question": "How many protein structures related to CRISPR Cas9 are currently available in the PDB?",
    "expected_answer": "461 structures",
    "notes": "Database: PDB. Tests comprehensive structural data counting. Number reflects current PDB contents and may increase over time. Verified using search_pdb_entity('CRISPR Cas9'). Found in pdb_exploration.md."
  },
  {
    "id": 5,
    "category": "Integration",
    "question": "What is the NCBI Gene ID for the protein with UniProt accession P04637?",
    "expected_answer": "7157",
    "notes": "Databases: UniProt, NCBI Gene. Tests cross-database ID conversion. P04637 is TP53 (tumor protein p53). Verified using togoid_convertId or UniProt cross-references. Found in uniprot_exploration.md and ncbigene_exploration.md."
  },
  {
    "id": 6,
    "category": "Integration",
    "question": "What is the ChEBI identifier for ATP referenced in biochemical reactions?",
    "expected_answer": "CHEBI:30616",
    "notes": "Databases: ChEBI, Rhea. Tests chemical entity identification in reaction databases. ATP is adenosine 5'-triphosphate. Verified using OLS4 search in ChEBI or Rhea reaction queries. Found in chebi_exploration.md and rhea_exploration.md."
  },
  {
    "id": 7,
    "category": "Currency",
    "question": "What pathways in Reactome involve SARS-CoV-2 proteins?",
    "expected_answer": "Multiple pathways including viral infection mechanisms, immune response, and host-virus interactions",
    "notes": "Database: Reactome. Tests access to recent pathway data for COVID-19 research. SARS-CoV-2 pathways were added after 2020. Verified using search_reactome_entity('SARS-CoV-2'). Found in reactome_exploration.md."
  },
  {
    "id": 8,
    "category": "Currency",
    "question": "How many variant records are currently in ClinVar?",
    "expected_answer": "Approximately 3.5 million variant records",
    "notes": "Database: ClinVar. Tests access to current database size. ClinVar is continuously updated with new variant submissions. Baseline knowledge from Jan 2025 may be outdated. Verified via SPARQL count query. Found in clinvar_exploration.md."
  },
  {
    "id": 9,
    "category": "Specificity",
    "question": "What is the MeSH descriptor ID for Erdheim-Chester disease?",
    "expected_answer": "D031249",
    "notes": "Database: MeSH. Tests rare disease medical terminology. Erdheim-Chester is a rare histiocytic disorder. Baseline unlikely to know specific MeSH IDs for rare conditions. Verified using search_mesh_entity('Erdheim-Chester'). Found in mesh_exploration.md."
  },
  {
    "id": 10,
    "category": "Specificity",
    "question": "What is the NANDO identifier for Parkinson disease in the Japanese rare disease database?",
    "expected_answer": "NANDO:1200010 or NANDO:2200392",
    "notes": "Database: NANDO. Tests Japanese rare disease nomenclature. NANDO provides multilingual disease terminology. Baseline unlikely to know Japanese database-specific IDs. Verified using SPARQL query in NANDO. Found in nando_exploration.md."
  },
  {
    "id": 11,
    "category": "Structured Query",
    "question": "Find all Gene Ontology terms in the biological_process namespace that contain the word 'apoptosis'.",
    "expected_answer": "Multiple GO terms including GO:0006915 (apoptotic process) and related child terms",
    "notes": "Database: GO. Tests namespace filtering and text search. Requires structured query with namespace constraint. Baseline cannot execute such specific database queries. Verified using OLS4:searchClasses with namespace filter. Found in go_exploration.md."
  },
  {
    "id": 12,
    "category": "Structured Query",
    "question": "What are the direct parent terms of the Gene Ontology term 'macroautophagy' (GO:0016236)?",
    "expected_answer": "GO:0006914 (autophagy)",
    "notes": "Database: GO. Tests ontology hierarchy navigation with ancestor relationships. Requires understanding parent-child term structure. Verified using OLS4:getAncestors limiting to direct parents. Found in go_exploration.md."
  }
]
