[
  {
    "id": 49,
    "category": "Precision",
    "question": "What is the MeSH descriptor ID for Diabetes Mellitus?",
    "expected_answer": "D003920",
    "notes": "Uses MeSH database. Verified in mesh_exploration.md using search_mesh_entity. MeSH provides controlled vocabulary for biomedical literature indexing with 30,248 topical descriptors."
  },
  {
    "id": 50,
    "category": "Precision",
    "question": "What is the NCBI Gene ID for the human insulin gene?",
    "expected_answer": "3630 (gene symbol: INS)",
    "notes": "Uses NCBI Gene database. Verified in ncbigene_exploration.md. Insulin is a critical hormone gene with extensive orthology across species. Tests gene identifier retrieval."
  },
  {
    "id": 51,
    "category": "Completeness",
    "question": "How many transport reactions with explicit cellular locations are in Rhea?",
    "expected_answer": "5,984 transport reactions (35% of total)",
    "notes": "Uses Rhea database. Verified in rhea_exploration.md showing transport reactions with rhea:In and rhea:Out location annotations. Tests specialized reaction class counting."
  },
  {
    "id": 52,
    "category": "Completeness",
    "question": "How many alternative transcripts does the human TP53 gene have in Ensembl?",
    "expected_answer": "20+ transcripts",
    "notes": "Uses Ensembl database. Verified in ensembl_exploration.md demonstrating extensive alternative splicing. All TP53 transcripts encode proteins. Tests transcript isoform enumeration."
  },
  {
    "id": 53,
    "category": "Integration",
    "question": "What ChEBI identifier corresponds to the ATP compound in Rhea?",
    "expected_answer": "CHEBI:30616",
    "notes": "Uses Rhea and ChEBI databases. Verified in rhea_exploration.md showing 100% ChEBI coverage for all 11,763 small molecules. ATP has formula C10H12N5O13P3 and charge -4."
  },
  {
    "id": 54,
    "category": "Integration",
    "question": "What GO molecular function terms are associated with ATP-related reactions in Rhea?",
    "expected_answer": "Multiple GO terms (GO:XXXXXXX) via rdfs:seeAlso, ~55% coverage",
    "notes": "Uses Rhea and GO databases. Verified in rhea_exploration.md showing rdfs:seeAlso links to GO molecular function terms for enzyme reactions."
  },
  {
    "id": 55,
    "category": "Currency",
    "question": "How many bioactivity measurements are currently in the ChEMBL database?",
    "expected_answer": "20 million bioactivity measurements from 1.6 million assays",
    "notes": "Uses ChEMBL database. Verified in chembl_exploration.md showing 2.4M+ compounds with 20M bioactivity measurements. Tests understanding of drug discovery data scale."
  },
  {
    "id": 56,
    "category": "Currency",
    "question": "What is the current number of FDA-approved drugs in PubChem?",
    "expected_answer": "17,367 FDA-approved drugs",
    "notes": "Uses PubChem database. Verified in pubchem_exploration.md showing explicit vocab:FDAApprovedDrugs classification. Tests pharmaceutical database currency."
  },
  {
    "id": 57,
    "category": "Specificity",
    "question": "What are the growth temperature and oxygen tolerance characteristics of Campylobacter pinnipediorum in BacDive?",
    "expected_answer": "Temperature 22-42°C, microaerotolerant, thermophilic, Gram-negative",
    "notes": "Uses BacDive database. Verified in bacdive_exploration.md showing detailed phenotypic characterization. Isolated from California sea lion abscess. Tests bacterial phenotype retrieval."
  },
  {
    "id": 58,
    "category": "Specificity",
    "question": "What is the R-free refinement statistic for PDB entry 5D8V?",
    "expected_answer": "Available in PDB refinement data (5D8V has R-work 0.072, the highest resolution structure at 0.48 Å)",
    "notes": "Uses PDB database. Verified in pdb_exploration.md showing 5D8V is one of two structures with world-record 0.48 Å resolution. Tests crystallographic quality metrics retrieval."
  },
  {
    "id": 59,
    "category": "Structured Query",
    "question": "Find all Gram-positive bacteria in BacDive that exhibit gelatinase enzyme activity.",
    "expected_answer": "Multiple species including Bacillus subtilis, Bacillus aryabhattai",
    "notes": "Uses BacDive database. Verified in bacdive_exploration.md showing enzyme activities linked via schema:describesStrain. Tests multi-phenotype filtering with OPTIONAL clauses."
  },
  {
    "id": 60,
    "category": "Structured Query",
    "question": "Count how many GO terms are in each of the three main namespaces.",
    "expected_answer": "biological_process: 30,804, molecular_function: 12,793, cellular_component: 4,568",
    "notes": "Uses GO database. Verified in go_exploration.md showing namespace distribution via oboinowl:hasOBONamespace. Tests ontology structure understanding with aggregation."
  }
]
