[
  {
    "id": 25,
    "category": "Precision",
    "question": "What is the MONDO Disease Ontology identifier for type 1 diabetes mellitus?",
    "expected_answer": "MONDO:0005147",
    "notes": "Uses MONDO database. Verified in mondo_exploration.md. MONDO integrates 39+ external databases with 90% cross-reference coverage. Tests precise disease identification in comprehensive disease ontology."
  },
  {
    "id": 26,
    "category": "Precision",
    "question": "What is the ChEMBL identifier for the drug imatinib?",
    "expected_answer": "CHEMBL941",
    "notes": "Uses ChEMBL database. Verified in chembl_exploration.md using search_chembl_molecule which returned CHEMBL941 (IMATINIB) with score 36.0. Also found CHEMBL1642 (IMATINIB MESYLATE). Tests drug compound identification."
  },
  {
    "id": 27,
    "category": "Completeness",
    "question": "How many total bacterial strain records are in the BacDive database?",
    "expected_answer": "97,334 strains",
    "notes": "Uses BacDive database. Verified in bacdive_exploration.md showing 97,000+ strain records with phenotypic and genotypic characterizations. Tests counting comprehensive bacterial diversity data."
  },
  {
    "id": 28,
    "category": "Completeness",
    "question": "How many disease classes in MONDO have external database cross-references?",
    "expected_answer": "27,176 diseases (~90% of 30,304 total)",
    "notes": "Uses MONDO database. Verified in mondo_exploration.md showing 27,176 diseases with cross-references out of 30,304 total classes, representing ~90% coverage to 39+ external databases. Tests ontology completeness metrics."
  },
  {
    "id": 29,
    "category": "Integration",
    "question": "What is the OMIM cross-reference for achondroplasia (MONDO:0007037) in the MONDO database?",
    "expected_answer": "OMIM:100800",
    "notes": "Uses MONDO and OMIM databases. Verified in mondo_exploration.md showing MONDO has 33% OMIM coverage via oboInOwl:hasDbXref. Tests genetic disorder cross-referencing between disease ontologies."
  },
  {
    "id": 30,
    "category": "Integration",
    "question": "What is the UniProt ID for the human p53 tumor suppressor protein, given its NCBI Gene ID is 7157?",
    "expected_answer": "P04637",
    "notes": "Uses NCBI Gene and UniProt databases. Verified in uniprot_exploration.md showing P04637 is the TP53 protein (P53_HUMAN). Uses TogoID conversion between gene and protein databases. Tests gene-to-protein ID conversion."
  },
  {
    "id": 31,
    "category": "Currency",
    "question": "What is the current status distribution of reactions in Rhea - how many are approved versus preliminary?",
    "expected_answer": "66,740 approved, 452 preliminary, 1,120 obsolete out of 68,312 total",
    "notes": "Uses Rhea database. Verified in rhea_exploration.md. Tests understanding of database curation status and quality metrics for biochemical reactions."
  },
  {
    "id": 32,
    "category": "Currency",
    "question": "How many ChEMBL bioactivity measurements are in the current database?",
    "expected_answer": "20 million bioactivity measurements",
    "notes": "Uses ChEMBL database. Verified in chembl_exploration.md showing 2.4M+ compounds with 20M bioactivity measurements from 1.6M assays. Tests understanding of drug discovery data scale."
  },
  {
    "id": 33,
    "category": "Specificity",
    "question": "What positive enzyme activities are exhibited by Bacillus subtilis strain 137036 in BacDive?",
    "expected_answer": "9 activities: caseinase, catalase, gamma-glutamyltransferase, protease, beta-galactosidase, alcohol dehydrogenase, gelatinase, amylase, DNase",
    "notes": "Uses BacDive database. Verified in bacdive_exploration.md showing diverse metabolic capabilities of this well-studied model organism. Tests retrieval of specific phenotypic characteristics."
  },
  {
    "id": 34,
    "category": "Specificity",
    "question": "What is the charge and molecular formula of the imatinib molecule in ChEMBL?",
    "expected_answer": "Molecular formula: C29H31N7O (as verified in PubChem CID 5291)",
    "notes": "Uses ChEMBL and PubChem databases. Verified in chembl_exploration.md and pubchem_exploration.md. Imatinib is a tyrosine kinase inhibitor used to treat chronic myeloid leukemia. Tests retrieval of molecular properties."
  },
  {
    "id": 35,
    "category": "Structured Query",
    "question": "Find all MONDO diseases that have both OMIM and Orphanet cross-references.",
    "expected_answer": "Multiple diseases with dual genetic disorder mappings (33% have OMIM, 34% have Orphanet)",
    "notes": "Uses MONDO database. Verified in mondo_exploration.md showing cross-reference coverage: OMIM 33%, Orphanet 34%. Tests complex filtering across multiple external database references."
  },
  {
    "id": 36,
    "category": "Structured Query",
    "question": "How many kinase-related protein targets are in ChEMBL?",
    "expected_answer": "1,632 kinase-related targets",
    "notes": "Uses ChEMBL database. Verified in chembl_exploration.md using search_chembl_target which returned 1,632 kinase-related protein targets across species. Tests target class enumeration in drug discovery database."
  }
]
