[
  {
    "id": 109,
    "category": "Precision",
    "question": "What is the DSM culture collection number for Escherichia coli strain K-12 in BacDive?",
    "expected_answer": "DSM number available via schema:hasLink to DSMZ catalogue",
    "notes": "Uses BacDive database. Verified in bacdive_exploration.md showing >90% DSMZ coverage via culture collection links. Tests institutional collection integration."
  },
  {
    "id": 110,
    "category": "Precision",
    "question": "What is the tree number classification for Diabetes Mellitus in MeSH?",
    "expected_answer": "C18.452.394.750 and other tree codes",
    "notes": "Uses MeSH database. Verified in mesh_exploration.md showing meshv:treeNumber provides hierarchical alphanumeric codes. ~95% descriptors have tree numbers. Tests MeSH hierarchy."
  },
  {
    "id": 111,
    "category": "Completeness",
    "question": "How many ingredients are documented in the MediaDive culture media database?",
    "expected_answer": "1,489 ingredients",
    "notes": "Uses MediaDive database. Verified in mediadive_exploration.md showing ingredients with chemical formulas and cross-references (ChEBI 32%, PubChem 18%, KEGG 13%)."
  },
  {
    "id": 112,
    "category": "Completeness",
    "question": "How many stereoisomers does ibuprofen have in PubChem?",
    "expected_answer": "Multiple stereoisomers via cheminf:CHEMINF_000455",
    "notes": "Uses PubChem database. Verified in pubchem_exploration.md showing average 2.3 stereoisomers per compound. CID3672 is ibuprofen. Tests stereochemistry enumeration."
  },
  {
    "id": 113,
    "category": "Integration",
    "question": "What is the UniProt Taxonomy link for human (taxon 9606) from NCBI Taxonomy?",
    "expected_answer": "Link via rdfs:seeAlso to UniProt Taxonomy (~100% coverage)",
    "notes": "Uses NCBI Taxonomy and UniProt databases. Verified in taxonomy_exploration.md showing rdfs:seeAlso cross-references. Tests taxonomic-protein database linking."
  },
  {
    "id": 114,
    "category": "Integration",
    "question": "Find the GO molecular function term for Rhea reaction RHEA:19697.",
    "expected_answer": "GO:0047520 (linked via rdfs:seeAlso)",
    "notes": "Uses Rhea and GO databases. Verified in rhea_exploration.md showing ~55% of reactions have GO molecular function terms. Tests enzyme-function ontology integration."
  },
  {
    "id": 115,
    "category": "Currency",
    "question": "How many 16S rRNA sequences are available in BacDive?",
    "expected_answer": "87,045 sequences (~35% coverage)",
    "notes": "Uses BacDive database. Verified in bacdive_exploration.md showing molecular characterization data. Note: database also contains complete genomes in same field. Tests sequence data currency."
  },
  {
    "id": 116,
    "category": "Currency",
    "question": "What is the current percentage of MediaDive culture media with PDF documentation links?",
    "expected_answer": "99% (schema:hasLinkToSource)",
    "notes": "Uses MediaDive database. Verified in mediadive_exploration.md showing near-complete documentation coverage with DSMZ PDF protocols."
  },
  {
    "id": 117,
    "category": "Specificity",
    "question": "What is the isolation source and geographic coordinates of Thermodesulfatator atlanticus in BacDive?",
    "expected_answer": "International waters in Atlantic Ocean, coordinates 36.23°N, -33.90°W",
    "notes": "Uses BacDive database. Verified in bacdive_exploration.md showing schema:hasLatitude and schema:hasLongitude for geographic locations. Tests marine strain provenance."
  },
  {
    "id": 118,
    "category": "Specificity",
    "question": "What allowable qualifiers can be used with the Diabetes Mellitus MeSH descriptor?",
    "expected_answer": "~22 qualifiers per descriptor average (e.g., 'drug therapy', 'diagnosis', 'complications')",
    "notes": "Uses MeSH database. Verified in mesh_exploration.md showing meshv:allowableQualifier relationships. Tests MeSH indexing rules and constraints."
  },
  {
    "id": 119,
    "category": "Structured Query",
    "question": "Find all thermophilic bacterial strains in BacDive with temperature ranges above 45°C.",
    "expected_answer": "Multiple strains with 'thermophilic' in description and schema:hasTemperatureRangeEnd > 45",
    "notes": "Uses BacDive database. Verified in bacdive_exploration.md showing bif:contains for phenotype search combined with numeric temperature filtering. Tests multi-criteria strain queries."
  },
  {
    "id": 120,
    "category": "Structured Query",
    "question": "Count MeSH descriptors by their main tree category (A through N).",
    "expected_answer": "Distribution across 16 main categories: A (Anatomy), B (Organisms), C (Diseases), D (Chemicals), etc.",
    "notes": "Uses MeSH database. Verified in mesh_exploration.md showing meshv:treeNumber with category prefixes. Tests MeSH classification structure and aggregation queries."
  }
]
